{
  "meta": {
    "project": "Vector Leads",
    "snapshotVersion": "1.0.0",
    "week": 3,
    "period": {
      "start": "2026-03-09",
      "end": "2026-03-15"
    },
    "generatedAt": "2026-03-12T00:00:00Z",
    "generatedBy": "claude-sonnet-4-6",
    "previousSnapshotWeek": 2
  },

  "git": {
    "branch": "main",
    "totalCommits": 34,
    "weekCommits": 19,
    "pullRequests": {
      "merged": 8,
      "open": 0
    },
    "linesAdded": 41596,
    "linesRemoved": 7660,
    "filesChanged": 219,
    "commitLog": [
      { "hash": "e1f72f0", "date": "2026-02-10", "message": "first commit",                                                                              "type": "chore",    "isMerge": false, "pr": null },
      { "hash": "2279ffd", "date": "2026-02-14", "message": "feat: add Groq as primary LLM provider with multi-provider support",                        "type": "feat",     "isMerge": false, "pr": 1 },
      { "hash": "644ddf6", "date": "2026-02-14", "message": "Merge pull request #1 from ericlimabr/feat/add-groq-llm-support",                          "type": "merge",    "isMerge": true,  "pr": 1 },
      { "hash": "f40c005", "date": "2026-02-14", "message": "fix: correct directory structure and update to Next.js 16 with Python 3.13 support",        "type": "fix",      "isMerge": false, "pr": 2 },
      { "hash": "f168f16", "date": "2026-02-14", "message": "Merge pull request #2 from ericlimabr/fix/project-structure-and-deps",                     "type": "merge",    "isMerge": true,  "pr": 2 },
      { "hash": "d47e07c", "date": "2026-02-14", "message": "feat: complete project setup — Next.js 16, Python 3.13, Groq integration",                 "type": "feat",     "isMerge": false, "pr": 3 },
      { "hash": "b6efd6f", "date": "2026-02-14", "message": "Merge pull request #3 from ericlimabr/feat/complete-project-setup",                        "type": "merge",    "isMerge": true,  "pr": 3 },
      { "hash": "2c64861", "date": "2026-02-25", "message": "feat(ai-worker): implement core AI worker with BANT qualification engine",                  "type": "feat",     "isMerge": false, "pr": 4 },
      { "hash": "4c657c8", "date": "2026-02-25", "message": "Merge pull request #4 from ericlimabr/feat/ai-worker-core",                                "type": "merge",    "isMerge": true,  "pr": 4 },
      { "hash": "ddc9653", "date": "2026-02-26", "message": "feat(ai-worker): implement SOLID principles, JWT auth, and streaming responses",            "type": "feat",     "isMerge": false, "pr": 5 },
      { "hash": "286f665", "date": "2026-02-26", "message": "Merge pull request #5 from ericlimabr/fix/ai-worker-security-solid",                       "type": "merge",    "isMerge": true,  "pr": 5 },
      { "hash": "aa8e477", "date": "2026-02-27", "message": "feat(maestro): implement core backend — domain, repositories, middleware, server",          "type": "feat",     "isMerge": false, "pr": 6 },
      { "hash": "666278a", "date": "2026-02-27", "message": "Merge pull request #6 from ericlimabr/feat/maestro-core",                                  "type": "merge",    "isMerge": true,  "pr": 6 },
      { "hash": "5a68c20", "date": "2026-03-05", "message": "feat(auth): implement frontend auth flow and harden maestro security",                      "type": "feat",     "isMerge": false, "pr": 7 },
      { "hash": "47a07fb", "date": "2026-03-05", "message": "Merge pull request #7 from ericlimabr/feat/frontend-auth",                                 "type": "merge",    "isMerge": true,  "pr": 7 },
      { "hash": "ebe0942", "date": "2026-03-09", "message": "feat(maestro): complete Step 5 — conversation management",                                 "type": "feat",     "isMerge": false, "pr": 8 },
      { "hash": "bc6d0d6", "date": "2026-03-09", "message": "Merge pull request #8 from ericlimabr/feat/maestro-step5",                                 "type": "merge",    "isMerge": true,  "pr": 8 },
      { "hash": "4e0eee9", "date": "2026-03-09", "message": "feat(maestro): Step 6 — AI Worker HTTP client + Layer 1 unit tests",                       "type": "feat",     "isMerge": false, "pr": 9 },
      { "hash": "bbb7dab", "date": "2026-03-09", "message": "Merge pull request #9 from ericlimabr/feat/maestro-step6-unit-tests",                      "type": "merge",    "isMerge": true,  "pr": 9 },
      { "hash": "856351c", "date": "2026-03-09", "message": "test(maestro): complete Layer 1 unit tests — handlers, middleware, config",                 "type": "test",     "isMerge": false, "pr": 10 },
      { "hash": "6dec91a", "date": "2026-03-10", "message": "test(maestro): Layer 2 integration tests — repositories + full HTTP stack",                 "type": "test",     "isMerge": false, "pr": 10 },
      { "hash": "81e4488", "date": "2026-03-10", "message": "Merge pull request #10 from ericlimabr/test/unit-layer1-complete",                         "type": "merge",    "isMerge": true,  "pr": 10 },
      { "hash": "271c4c8", "date": "2026-03-11", "message": "feat(maestro): Step 7 — WebSocket streaming bridge + tests",                               "type": "feat",     "isMerge": false, "pr": 11 },
      { "hash": "43e86cb", "date": "2026-03-11", "message": "Merge pull request #11 from ericlimabr/feat/maestro-step7",                                "type": "merge",    "isMerge": true,  "pr": 11 },
      { "hash": "0846f70", "date": "2026-03-11", "message": "feat(maestro): Steps 8 + 9 — Redis integration, RBAC middleware + Postman",                "type": "feat",     "isMerge": false, "pr": 12 },
      { "hash": "aee97a2", "date": "2026-03-11", "message": "Merge pull request #12 from ericlimabr/feat/maestro-steps8-9",                             "type": "merge",    "isMerge": true,  "pr": 12 },
      { "hash": "989f3a7", "date": "2026-03-11", "message": "test(ai-worker): unit + integration tests — 71 unit, 12 integration",                      "type": "test",     "isMerge": false, "pr": 13 },
      { "hash": "4f8fb0b", "date": "2026-03-12", "message": "Merge pull request #13 from ericlimabr/test/ai-worker-unit-integration",                   "type": "merge",    "isMerge": true,  "pr": 13 },
      { "hash": "f7d2f51", "date": "2026-03-12", "message": "fix(docs): correct 5 inconsistencies across HLD, API, costs and testing docs",             "type": "fix",      "isMerge": false, "pr": 14 },
      { "hash": "992157f", "date": "2026-03-12", "message": "Merge pull request #14 from ericlimabr/fix/docs-inconsistencies",                          "type": "merge",    "isMerge": true,  "pr": 14 },
      { "hash": "91f00ca", "date": "2026-03-12", "message": "feat(frontend): Steps 3-5 — layout shell, lead management, chat UI + brand",               "type": "feat",     "isMerge": false, "pr": 15 },
      { "hash": "0d90767", "date": "2026-03-12", "message": "feat(frontend): Steps 3-5 — layout shell, lead management, chat UI + brand",               "type": "feat",     "isMerge": false, "pr": 15 },
      { "hash": "4c9a824", "date": "2026-03-12", "message": "feat(roadmap): detail Phase 2 roadmap — maestro, ai-worker, frontend (9+7+8 steps)",       "type": "docs",     "isMerge": false, "pr": 15 },
      { "hash": "c6060df", "date": "2026-03-12", "message": "Merge pull request #15 from ericlimabr/feat/frontend-steps3-5",                            "type": "merge",    "isMerge": true,  "pr": 15 }
    ]
  },

  "overallProgress": {
    "phase1PercentComplete": 90,
    "phase2PercentComplete": 0,
    "phase3PercentComplete": 0,
    "phase4PercentComplete": 0,
    "productPercentComplete": 36,
    "weekDelta": {
      "phase1": 20,
      "phase2": 0,
      "phase3": 0,
      "phase4": 0,
      "product": 8
    }
  },

  "phases": {
    "phase1": {
      "id": "phase1",
      "name": "MVP e Validação de Fluxo",
      "description": "Core backend, AI qualification engine, and minimal chat frontend — the full end-to-end BANT flow running in production.",
      "status": "in_progress",
      "percentComplete": 90,
      "weekDelta": 20,
      "estimatedWeeks": "6-8",
      "steps": [
        {
          "id": "p1-s0",
          "name": "Project Setup & Infrastructure",
          "description": "Monorepo structure, Docker Compose stack, environment config, database init script, Makefile automation.",
          "weight": 7,
          "percentComplete": 100,
          "status": "complete",
          "weekDelta": 0,
          "subTasks": [
            { "name": "Monorepo directory structure (maestro, ai-worker, frontend)", "done": true },
            { "name": "Docker Compose — postgres, redis, qdrant, minio, maestro, ai-worker, frontend", "done": true },
            { "name": "PostgreSQL init script with RLS, extensions, seed data", "done": true },
            { "name": "Makefile with 70+ targets (dev, test, build, lint, deploy)", "done": true },
            { "name": ".env.example with all env vars documented", "done": true },
            { "name": "Optional monitoring stack (Prometheus + Grafana via profile)", "done": true },
            { "name": "Postman API collection", "done": true }
          ]
        },
        {
          "id": "p1-s1",
          "name": "Maestro — Domain Layer",
          "description": "Go domain entities (Lead, Conversation, Message, Tenant, User), validation helpers, custom error types, repository port interfaces.",
          "weight": 12,
          "percentComplete": 100,
          "status": "complete",
          "weekDelta": 0,
          "subTasks": [
            { "name": "Lead entity with BANT score, status enum, Validate()", "done": true },
            { "name": "Conversation entity with status machine, Validate()", "done": true },
            { "name": "Message entity with role enum, content-length cap, Validate()", "done": true },
            { "name": "Tenant entity with config JSONB, domain normalisation, Validate()", "done": true },
            { "name": "User entity with role enum", "done": true },